rank,report,value
#666,top zip codes in america with the most business establishments zip codes â» economy,1347
"#1,427",top zip codes in america with the largest population density zip codes â» population,"5,710"
"#1,534",top zip codes in america with the highest owner-to-tenant housing occupied ratio zip codes â» housing,1:1.17
"#1,559",top zip codes in america with the lowest percentage of english language spoken zip codes â» languages spoken,top zip codes in america with the highest married-to-other couples ratio zip codes â» families
"#1,807",52%,1:0.71
